{
  "note": "Volatile historical public snapshots, not trading signals.",
  "snapshots": [
    {
      "bonding_curve_progress": 100.0,
      "holders": "unavailable from free API snapshot",
      "liquidity_usd": 4635,
      "market_cap_usd": 3551,
      "notes": "Volatile historical public snapshot; not a trading signal.",
      "price_usd": "0.000003551",
      "source_file": "data/snapshots/2026-04-23T19-48-08Z.json",
      "timestamp": "2026-04-23T19:48:08Z",
      "token_address": "jSHyGRfqkGBKdjUPrZXaqPXzFpBTjimJtheWZJRpump",
      "volume_h24_usd": 94749.66
    },
    {
      "bonding_curve_progress": 100.0,
      "holders": "unavailable from free API snapshot",
      "liquidity_usd": 4553.92,
      "market_cap_usd": 3421,
      "notes": "Volatile historical public snapshot; not a trading signal.",
      "price_usd": "0.000003421",
      "source_file": "data/snapshots/2026-04-23T19-57-39Z.json",
      "timestamp": "2026-04-23T19:57:39Z",
      "token_address": "jSHyGRfqkGBKdjUPrZXaqPXzFpBTjimJtheWZJRpump",
      "volume_h24_usd": 94818.81
    },
    {
      "bonding_curve_progress": 100.0,
      "holders": "Unavailable from free public snapshot",
      "liquidity_usd": 5443.87,
      "market_cap_usd": 4881,
      "notes": "Volatile historical public snapshot; not a trading signal.",
      "price_usd": "0.000004880",
      "source_file": "data/snapshots/2026-04-23T20-31-19Z.json",
      "timestamp": "2026-04-23T20:31:19Z",
      "token_address": "jSHyGRfqkGBKdjUPrZXaqPXzFpBTjimJtheWZJRpump",
      "volume_h24_usd": 95498.38
    },
    {
      "bonding_curve_progress": 100.0,
      "holders": "Unavailable from free public snapshot",
      "liquidity_usd": 5203.28,
      "market_cap_usd": 4321,
      "notes": "Volatile historical public snapshot; not a trading signal.",
      "price_usd": "0.000004320",
      "source_file": "data/snapshots/2026-04-24T14-52-32Z.json",
      "timestamp": "2026-04-24T14:52:32Z",
      "token_address": "jSHyGRfqkGBKdjUPrZXaqPXzFpBTjimJtheWZJRpump",
      "volume_h24_usd": 268941.13
    },
    {
      "bonding_curve_progress": 100.0,
      "holders": "Unavailable from free public snapshot",
      "liquidity_usd": 4082.63,
      "market_cap_usd": 2656,
      "notes": "Volatile historical public snapshot; not a trading signal.",
      "price_usd": "0.000002656",
      "source_file": "data/snapshots/2026-04-25T14-12-40Z.json",
      "timestamp": "2026-04-25T14:12:40Z",
      "token_address": "jSHyGRfqkGBKdjUPrZXaqPXzFpBTjimJtheWZJRpump",
      "volume_h24_usd": 1320.88
    },
    {
      "bonding_curve_progress": 100.0,
      "holders": "Unavailable from free public snapshot",
      "liquidity_usd": 4227.98,
      "market_cap_usd": 2855,
      "notes": "Volatile historical public snapshot; not a trading signal.",
      "price_usd": "0.000002856",
      "source_file": "data/snapshots/2026-04-26T13-37-01Z.json",
      "timestamp": "2026-04-26T13:37:01Z",
      "token_address": "jSHyGRfqkGBKdjUPrZXaqPXzFpBTjimJtheWZJRpump",
      "volume_h24_usd": 3530.66
    },
    {
      "bonding_curve_progress": 100.0,
      "holders": "Unavailable from free public snapshot",
      "liquidity_usd": 4553.52,
      "market_cap_usd": 3315,
      "notes": "Volatile historical public snapshot; not a trading signal.",
      "price_usd": "0.000003315",
      "source_file": "data/snapshots/2026-04-26T14-12-27Z.json",
      "timestamp": "2026-04-26T14:12:27Z",
      "token_address": "jSHyGRfqkGBKdjUPrZXaqPXzFpBTjimJtheWZJRpump",
      "volume_h24_usd": 3695.9
    },
    {
      "bonding_curve_progress": 100.0,
      "holders": "Unavailable from free public snapshot",
      "liquidity_usd": 5621.29,
      "market_cap_usd": 5092,
      "notes": "Volatile historical public snapshot; not a trading signal.",
      "price_usd": "0.000005093",
      "source_file": "data/snapshots/2026-04-27T15-23-10Z.json",
      "timestamp": "2026-04-27T15:23:10Z",
      "token_address": "jSHyGRfqkGBKdjUPrZXaqPXzFpBTjimJtheWZJRpump",
      "volume_h24_usd": 8971.25
    },
    {
      "bonding_curve_progress": 100.0,
      "holders": "Unavailable from free public snapshot",
      "liquidity_usd": 3964.17,
      "market_cap_usd": 2592,
      "notes": "Volatile historical public snapshot; not a trading signal.",
      "price_usd": "0.000002592",
      "source_file": "data/snapshots/2026-04-28T15-43-13Z.json",
      "timestamp": "2026-04-28T15:43:13Z",
      "token_address": "jSHyGRfqkGBKdjUPrZXaqPXzFpBTjimJtheWZJRpump",
      "volume_h24_usd": 2856.1
    },
    {
      "bonding_curve_progress": 100.0,
      "holders": "Unavailable from free public snapshot",
      "liquidity_usd": 6226.68,
      "market_cap_usd": 6380,
      "notes": "Volatile historical public snapshot; not a trading signal.",
      "price_usd": "0.000006381",
      "source_file": "data/snapshots/2026-04-29T15-32-38Z.json",
      "timestamp": "2026-04-29T15:32:38Z",
      "token_address": "jSHyGRfqkGBKdjUPrZXaqPXzFpBTjimJtheWZJRpump",
      "volume_h24_usd": 31211.16
    },
    {
      "bonding_curve_progress": 100.0,
      "holders": "Unavailable from free public snapshot",
      "liquidity_usd": 5043.49,
      "market_cap_usd": 4193,
      "notes": "Volatile historical public snapshot; not a trading signal.",
      "price_usd": "0.000004193",
      "source_file": "data/snapshots/2026-04-30T15-26-39Z.json",
      "timestamp": "2026-04-30T15:26:39Z",
      "token_address": "jSHyGRfqkGBKdjUPrZXaqPXzFpBTjimJtheWZJRpump",
      "volume_h24_usd": 5965.81
    },
    {
      "bonding_curve_progress": 100.0,
      "holders": "Unavailable from free public snapshot",
      "liquidity_usd": 6025.16,
      "market_cap_usd": 6006,
      "notes": "Volatile historical public snapshot; not a trading signal.",
      "price_usd": "0.000006007",
      "source_file": "data/snapshots/2026-04-30T23-10-48Z.json",
      "timestamp": "2026-04-30T23:10:48Z",
      "token_address": "jSHyGRfqkGBKdjUPrZXaqPXzFpBTjimJtheWZJRpump",
      "volume_h24_usd": 9349.36
    },
    {
      "bonding_curve_progress": 100.0,
      "holders": "Unavailable from free public snapshot",
      "liquidity_usd": 5749.24,
      "market_cap_usd": 5446,
      "notes": "Volatile historical public snapshot; not a trading signal.",
      "price_usd": "0.000005447",
      "source_file": "data/snapshots/2026-05-01T01-28-54Z.json",
      "timestamp": "2026-05-01T01:28:54Z",
      "token_address": "jSHyGRfqkGBKdjUPrZXaqPXzFpBTjimJtheWZJRpump",
      "volume_h24_usd": 9225.6
    },
    {
      "bonding_curve_progress": 100.0,
      "holders": "Unavailable from free public snapshot",
      "liquidity_usd": 5773.29,
      "market_cap_usd": 5435,
      "notes": "Volatile historical public snapshot; not a trading signal.",
      "price_usd": "0.000005436",
      "source_file": "data/snapshots/2026-05-01T14-35-57Z.json",
      "timestamp": "2026-05-01T14:35:57Z",
      "token_address": "jSHyGRfqkGBKdjUPrZXaqPXzFpBTjimJtheWZJRpump",
      "volume_h24_usd": 7420.6
    },
    {
      "bonding_curve_progress": 100.0,
      "holders": "Unavailable from free public snapshot",
      "liquidity_usd": 13112.94,
      "market_cap_usd": 27752,
      "notes": "Volatile historical public snapshot; not a trading signal.",
      "price_usd": "0.00002775",
      "source_file": "data/snapshots/2026-05-02T14-28-42Z.json",
      "timestamp": "2026-05-02T14:28:42Z",
      "token_address": "jSHyGRfqkGBKdjUPrZXaqPXzFpBTjimJtheWZJRpump",
      "volume_h24_usd": 141459.99
    },
    {
      "bonding_curve_progress": 100.0,
      "holders": "Unavailable from free public snapshot",
      "liquidity_usd": 9144.05,
      "market_cap_usd": 13422,
      "notes": "Volatile historical public snapshot; not a trading signal.",
      "price_usd": "0.00001342",
      "source_file": "data/snapshots/2026-05-03T14-27-23Z.json",
      "timestamp": "2026-05-03T14:27:23Z",
      "token_address": "jSHyGRfqkGBKdjUPrZXaqPXzFpBTjimJtheWZJRpump",
      "volume_h24_usd": 70161.28
    },
    {
      "bonding_curve_progress": 100.0,
      "holders": "Unavailable from free public snapshot",
      "liquidity_usd": 9189.95,
      "market_cap_usd": 13494,
      "notes": "Volatile historical public snapshot; not a trading signal.",
      "price_usd": "0.00001349",
      "source_file": "data/snapshots/2026-05-04T15-28-58Z.json",
      "timestamp": "2026-05-04T15:28:58Z",
      "token_address": "jSHyGRfqkGBKdjUPrZXaqPXzFpBTjimJtheWZJRpump",
      "volume_h24_usd": 12731.3
    },
    {
      "bonding_curve_progress": 100.0,
      "holders": "Unavailable from free public snapshot",
      "liquidity_usd": 13885.55,
      "market_cap_usd": 28626,
      "notes": "Volatile historical public snapshot; not a trading signal.",
      "price_usd": "0.00002863",
      "source_file": "data/snapshots/2026-05-06T15-40-01Z.json",
      "timestamp": "2026-05-06T15:40:01Z",
      "token_address": "jSHyGRfqkGBKdjUPrZXaqPXzFpBTjimJtheWZJRpump",
      "volume_h24_usd": 163669.93
    },
    {
      "bonding_curve_progress": 100.0,
      "holders": "Unavailable from free public snapshot",
      "liquidity_usd": 10780.04,
      "market_cap_usd": 17272,
      "notes": "Volatile historical public snapshot; not a trading signal.",
      "price_usd": "0.00001727",
      "source_file": "data/snapshots/2026-05-07T15-41-54Z.json",
      "timestamp": "2026-05-07T15:41:54Z",
      "token_address": "jSHyGRfqkGBKdjUPrZXaqPXzFpBTjimJtheWZJRpump",
      "volume_h24_usd": 33949.57
    },
    {
      "bonding_curve_progress": 100.0,
      "holders": "Unavailable from free public snapshot",
      "liquidity_usd": 8112.31,
      "market_cap_usd": 9691,
      "notes": "Volatile historical public snapshot; not a trading signal.",
      "price_usd": "0.000009693",
      "source_file": "data/snapshots/2026-05-08T15-07-30Z.json",
      "timestamp": "2026-05-08T15:07:30Z",
      "token_address": "jSHyGRfqkGBKdjUPrZXaqPXzFpBTjimJtheWZJRpump",
      "volume_h24_usd": 15111.62
    },
    {
      "bonding_curve_progress": 100.0,